Provider Electronic Solutions Software,Provider Electronic Solutions Software,Department of Vermont Health Access (AHS DVHA) / ,,http://www.vtmedicaid.com/Downloads/software.html,,,,"HP Enterprise Services (HPES) Provider Electronic Solutions program is designed to<br />provide the billing provider with a faster and more efficient method of transaction<br />submission and processing. Handling time and errors are reduced, eliminating delays in<br />processing and decreasing turnaround times.<br />Provider Electronic Solutions is a transaction entry software package developed by HPES<br />that meets the standards implemented by HIPAA. The software allows for electronic<br />transaction submission directly to the Northeast Regional HIPAA Translator.",,,Unknown,,,,,,No access to data,,,,None,No,,,Low,Full current documentation,,,,,,,,,Low,No,,Barbara Patterson,,,,
Vermont Active Medicaid Providers,Vermont Active Medicaid Providers,Department of Vermont Health Access (AHS DVHA) / ,,http://www.vtmedicaid.com/Downloads/providerLists.html,,,,"List of active medicaid providers in pdf, text, or excel format",,,Provider Information,,2015,,,,No access to data,Public,,,None,No,,,Low,Full current documentation,,,,,,,,,Low,No,,Barbara Patterson,,,,
VITLDirect,VITLDirect,VITL - VT HIE Network / ,,https://www.vitl.net/connect/provider-services/vitldirect,,,,"VITLDirect enables you to electronically send or receive patient data. For example, when you transfer or refer a patient to another health care organization, with VITLDirect you can securely transmit a summary of care record to the other provider. If your EHR supports secure messaging, you may be able to do this without leaving your EHR. Likewise, when a patient is sent to you, a summary of care record from the sending provider could be be received electronically in your EHR.   <br /><br />VITLDirect uses the nationwide Direct Project communication standards. That means it works with any other system that also uses Direct standards. You can securely send patient data to providers across town, or across the country.",,,Clinical,,,,,,No access to data,Practitioners (Health Care and Others),,,None,No,,,Low,No documentation,,,,,,,,,Low,No,,Barbara Patterson,,,,
VITLAccess,VITLAccess,VITL - VT HIE Network / ,,https://www.vitl.net/connect/provider-services/vitlaccess,,,,"VITL assembles patient information received from health care organizations across the state and with patient consent, gives you access to this information through a single secure portal. This information is available through the statewide health information network, called the Vermont Health Information Exchange.<br />The following is available from most hospitals:<br /><br />Lab test results<br />Radiology exam reports<br />Patient demographics<br />Discharge summaries<br />Independent labs are providing test results as well. Patient medication histories may be available, as well as clinical summaries from some primary care providers. Over time, the amount and scope of patient information will increase as the Vermont Health Information Exchange continues its build out.",,,Clinical,,,,,,No access to data,Practitioners (Health Care and Others),,,None,No,,,Low,No documentation,,,,,,,,,Low,No,,Barbara Patterson,,,,
School Environmental Health (Envision),School Environmental Health (Envision),Department of Health (AHS) / Division of Environmental Health,,http://healthvermont.gov/enviro/envision/documents/participation_survey_report_2013.pdf,David Grass,david.grass@state.vt.us,,Envision—Promoting Healthy School Environments was created by the Legislature in 2000 as part of the School Environmental Health Act (Act 125) to address these issues by providing model environmental health management plans and guidance for schools.,,,Survey,,2012-2013,,,,Aggregate data only,,,,None,No,,,Low,Full current documentation,,,,,,,,,Low,No,,Barbara Patterson,,,,
Outcomes of Well-Being for Vermonters (Act 186 - Agency of Human Services) ,Outcomes of Well-Being for Vermonters (Act 186 - Agency of Human Services) ,Agency of Human Services / ,,https://app.resultsscorecard.com/Scorecard/Embed/8131,Drusilla Roessle,dru.roessle@state.vt.us,,Data and information about how all Vermonters are doing in relation to statewide indicators.  The population-level outcomes/results and indicators presented in this Scorecard were established in the 2014 Legislative Session.  AHS reports this information to the Legislature annually.,,,"Population
Clinical",,,,,,Aggregate data only,,Web Application - Public,,None,No,,,Low,Full current documentation,,,,,,,,,Low,No,,Barbara Patterson,,,,
Agency of Human Services Indicators 2012-2015 ,Agency of Human Services Indicators 2012-2015 ,Agency of Human Services / ,,https://app.resultsscorecard.com/Scorecard/Embed/3614,Drusilla Roessle,dru.roessle@state.vt.us,,Contains data and information about how all Vermonters are doing in relation to statewide indicators.  The population-level outcomes/results and indicators presented in this Scorecard were established in the 2012-2015 AHS Strategic Plan. <br />,,,Population,,,,,,Aggregate data only,,Web Application - Public,,None,No,,,Low,Full current documentation,,,,,,,,,Low,No,,Barbara Patterson,,,,
Dashboard 2.0,Dashboard 2.0,Green Mountain Care Board (GMCB) / ,,http://gmcboard.vermont.gov/dashboard2,Susan Barrett,susan.barrett@state.vt.us,,"Dashboard 2.0 currently includes 51 indicators grouped into twelve categories across the developmental lifespan, each defined by a health-related goal statement. For example, in ""Pregnant Women and Infants Thrive,"" indicators related to prenatal care, breastfeeding, and birth outcomes are included. The structure of the indicators is designed to enable readers to quickly identify areas of interest to them, based on their relevant stage of life or community perspective.",,"Blueprint for Health Analytics Dataset
Youth Risk Behavior Survey
Immunization Registry - IMR
Behavioral Risk Factor Surveillance System (BRFSS)","Surveillance
Population
Financial",,,,,,Aggregate data only,Public,"Report (PDF, Word)",,None,No,,,Low,Full current documentation,,,,,,,,,Low,Yes,,Charlie Hofmann,,,,
Healthy Vermonters 2020 Performance Dashboard,Healthy Vermonters 2020 Performance Dashboard,Department of Health (AHS) / ,,http://healthvermont.gov/hv2020/dashboard/familyplanning.aspx,,,,"""How we are doing"" - The Performance Dashboard is built on the concepts of Results Based Accountability™ and displays current information to show: <br /><br />Population Indicators (such as smoking prevalence) are measures for which the Health Department, with state government and community partners, share responsibility for making change. All Healthy Vermonters 2020 indicators are displayed.<br />Performance Measures (such as the percentage of smokers registered with the Vermont Quit Network), are measures for which our programs are responsible for the performance of interventions - the things that, over time, will improve health - as reflected in the population indicators (such as reduced smoking prevalence).",,,Population,,,,,,Aggregate data only,Public,Web Application - Public,,None,No,,,Low,Full current documentation,,,,,,,,,Low,No,,Barbara Patterson,,,,
Healthy Vermonters 2020 Map and Trends Atlas,Healthy Vermonters 2020 Map and Trends Atlas,Department of Health (AHS) / ,,http://healthvermont.gov/hv2020/IA/FamilyPlanning/County/atlas.html,,,,"Health Department routinely uses three ways to assess population indicators (such as smoking prevalence) at the local level: by county, by district office area, and by hospital service area (HSA). Maps & Trends links you to maps, tables and graphs for all Healthy Vermonters 2020 indicators and goals.",,,Population,,,,,,Aggregate data only,Public,Web Application - Public,,None,No,,,Low,Full current documentation,,,,,,,,,Low,Yes,,Barbara Patterson,,,,
"SIDS,SUID","SIDS,SUID",Department of Health (AHS) / Division of Maternal and Child Health,,http://www.healthvermont.gov/family/SUDI/index.aspx,Sally Kerschner,sally.kerschner@state.vt.us,,Infant name and parent contact information following an unexpected death of an infant.,,,Clinical,,,,,,No access to data,,,,None,No,,,Low,Full current documentation,,,,,,,,,Low,No,,Barbara Patterson,,,,
Early Hearing Detection and Intervention (EHDI),Early Hearing Detection and Intervention (EHDI),Department of Health (AHS) / Division of Maternal and Child Health,,http://www.healthvermont.gov/family/hearing/index.aspx,Linda Hazard,linda.hazard@state.vt.us,,"VTEHDI works with hospitals and other community providers, such as early head start, homebirth midwives and primary care professionals to provide newborn and early periodic hearing screenings. The program provides support, training, and case management to families and their babies, and to community providers. These partnerships ensure timely referrals for diagnostic testing and early intervention services.",,,Youth,,,,,,No access to data,,,,None,No,,,Low,Full current documentation,,,,,,,,,Low,No,,Barbara Patterson,,,,
Personal Care / Children With Special Health Needs (CSHN),Personal Care / Children With Special Health Needs (CSHN),Department of Health (AHS) / Division of Maternal and Child Health,,http://healthvermont.gov/family/cshn/cshn.aspx,Jennifer Garabedian,jennifer.garabedian@state.vt.us,,"Name, DOB, UID, Address, County, Authorization Level, Service start/end date, Requesting/Supplying Provider Number, Procedure Code, Status (i.e., active, cancelled, denied)<br />""Routinely<br />At the individual level: For reassessment purposes—indicates when someone is due for reassessment, when s/he ages out of service, available regional assessors, specific levels of service<br /><br />At the aggregate level:  provides financial  information to VDH, DVHA and AHS Central Office Business Offices<br /><br />Ad hoc: May be used as needed to meet specific information requests (e.g., for Legislature, IFS or other sister-department initiatives) or to meet programmatic needs/changes (e.g., ICD-conversion, mass mailings)    <br />""<br />",,,Clinical,,,,,,No access to data,,,,None,No,,,Low,Full current documentation,,,,,,,,,Low,No,,Barbara Patterson,,,,
VT Medication Assistance Program ,VT Medication Assistance Program ,Department of Health (AHS) / Division of Health Surveillance,,http://healthvermont.gov/prevent/aids/aids_index.aspx#Anchor-Th-57625,Robyn Airoldi,,,"The Vermont Medication Assistance Program provides financial assistance for the purchase of prescription medications to Vermonters living with HIV disease who meets certain income guidelines. If you are eligible, this program may help pay for your treatment drugs, insurance premiums, co-pays and/or deductibles.<br />data transfered to VMAP database, CAREWare  ",,,Financial,,,,,,No access to data,,,,None,No,,,Low,Full current documentation,,,,,,,,,Low,No,,Barbara Patterson,,,,
Vermont Tick Tracker,Vermont Tick Tracker,Department of Health (AHS) / Division of Health Surveillance,,https://apps.health.vermont.gov/gis/vttracking/ticktracker/,,,,,,,Surveillance,,,,,,No access to data,,Web Application - Public,,None,No,,,Low,Full current documentation,,,,,,,,,Low,No,,Barbara Patterson,,,,
West Nile Virus Data (ArboNet),West Nile Virus Data (ArboNet),Department of Health (AHS) / Division of Health Surveillance,,http://healthvermont.gov/prevent/arbovirus/surveillance/index.aspx#plan,Erica Berl,,,,,,Unknown,,,,,,No access to data,,,,None,No,,,Low,Full current documentation,,,,,,,,,Low,No,,Barbara Patterson,,,,
Tuberculosis Data ,Tuberculosis Data ,Department of Health (AHS) / Division of Health Surveillance,,,Laura Ann Nicolai,,,"Demographic, clinical, and laboratory information, symptoms, exposure history, treatment<br />part of http://wwwn.cdc.gov/nndss/script/nedss.aspx",,,"Services Provided
Population
Clinical",,,,,,No access to data,,,,None,No,,,Low,Full current documentation,,,,,,,,,Low,No,,Barbara Patterson,,,,
Rabies (human exposures to animal cases),Rabies (human exposures to animal cases),Department of Health (AHS) / Division of Health Surveillance,,http://healthvermont.gov/prevent/rabies/Rabies.aspx#wns,Robert H. Johnson,,,,,,Clinical,,,,,,No access to data,,,,None,No,,,Low,Full current documentation,,,,,,,,,Low,No,,Barbara Patterson,,,,
Lyme Disease Data,Lyme Disease Data,Department of Health (AHS) / Division of Health Surveillance,,http://healthvermont.gov/prevent/lyme/surveillance_data.aspx#data,Erica Berl,,,,,,Surveillance,,2005 - Present,,,,Aggregate data only,,,,None,No,,,Low,Full current documentation,,,,,,,,,Low,No,,Barbara Patterson,,,,
Healthcare Associated Infections (HAI),Healthcare Associated Infections (HAI),Department of Health (AHS) / Division of Health Surveillance,,http://www.healthvermont.gov/prevent/HAI/index.aspx,Carol Wood-Koob,,,http://wwwn.cdc.gov/nndss/script/nedss.aspx,,,Clinical,,,,,,No access to data,,,,None,No,,,Low,Full current documentation,,,,,,,,,Low,No,,Barbara Patterson,,,,
BioSense,BioSense,Department of Health (AHS) / Division of Health Surveillance,,http://healthvermont.gov/hc/documents/meaningful_use_biosense2_data_set_requirements.pdf,Bradley Tompkins,,,"BioSense application is a public health surveillance system that increases the ability of health officials at local, state, and national levels to efficiently, rapidly and collaboratively monitor and respond to harmful health effects of exposure to disease or hazardous conditions.<br /><br />BioSense provides public health officials a common electronic health information system with standardized tools and procedures for rapidly collecting, sharing, and evaluating information.<br /><br />With BioSense, health officials can exchange information faster, improve their common awareness of health threats over time and across regional boundaries, and better coordinate investigations and community actions to protect health.",,,Surveillance,,,,,,No access to data,,,,None,No,,,Low,Full current documentation,,,,,,,,,Low,No,,Barbara Patterson,,,,
Project CRASH,Project CRASH,Department of Health (AHS) / Division of Alcohol and Drug Abuse Programs (ADAP),,http://healthvermont.gov/adap/treatment/crash.aspx, Jerri Brouillette,jerri.brouillette@state.vt.us,," Client DMV records, full identifying information, CRASH Intake Assessment, Completion and Treatment Information Forms (in and out of state) <br /> Ad hoc, program compliance, annual report, billing, program planning",,,Services Provided,,,,,,No access to data,,No Access / No Publication,,None,No,,,Low,Full current documentation,,,,,,,,,Low,No,,Barbara Patterson,,,,
Public Inebriate Program,Public Inebriate Program,Department of Health (AHS) / Division of Alcohol and Drug Abuse Programs (ADAP),,http://healthvermont.gov/adap/treatment/PublicInebriate.aspx, Jackie Corbally,,,"At grantee level, summarized data provided to ADAP",,,Unknown,,,,,,No access to data,,,,None,No,,,Low,No documentation,,,,,,,,,Low,No,,Barbara Patterson,,,,
"Screening, Brief Intervention, Referral to Treatment (SBIRT)","Screening, Brief Intervention, Referral to Treatment (SBIRT)",Department of Health (AHS) / Division of Alcohol and Drug Abuse Programs (ADAP),,http://sbirt.vermont.gov/, Erin O’Keefe,,,"GPRA, with unique ID rather than full identifying information, name/contact information for follow only (10% of population served)",,,"Services Provided
Clinical",,,,,,No access to data,,,,None,No,,,Low,No documentation,,,,,,,,,Low,No,,Barbara Patterson,,,,
Medicare Cost Reports,Medicare Cost Reports,Centers for Medicare and Medicaid Services (CMS) / ,,http://www.cms.gov/Research-Statistics-Data-and-Systems/Downloadable-Public-Use-Files/Cost-Reports/index.html,,,,"Detailed information on health care provider characteristics, costs, and utilization for hospitals, nursing homes, home health agencies, hospices, and renal dialysis facilities.",,,Financial,,Varies by provider type,,,,"Aggregate data only, report format",Policymakers,,,,No,,,Low,,,,,,,,,,Low,No,,Barbara Patterson,,,,
Project Rocking Horse,Project Rocking Horse,Department of Health (AHS) / Division of Alcohol and Drug Abuse Programs (ADAP),,, Patty Baroudi,,,"The Rocking Horse Circle of Support program is a local educational support group for low-income mothers. During the program’s first year, participants increased their perception of risk from drinking or smoking during pregnancy. Those who participated in the program also gained increased confidence in the ability to handle stress and parent their children.",,,Unknown,,,,,,No access to data,,"Report (PDF, Word)",,HIPPA,No,,,Low,,,,,,,,,,Low,No,,Charlie Hofmann,,,,
Ladies First,Ladies First,Department of Health (AHS) / Division of Health Promotion and Disease Prevention,,http://healthvermont.gov/prevent/ladies_first.aspx,Nicole Lukas,nicole.lukas@state.vt.us,,"Ladies First helps eligible women get breast, cervical and heart health screenings. Our members get free mammograms, Pap tests and heart health checkups (blood pressure, cholesterol and blood sugar testing). Ladies First also pays for diagnostic tests when needed; our nurse case manager is available to provide support and guidance. We help women make positive changes by referring members to free help for quitting smoking, nutrition counseling and health coaching, and by paying for certain weight loss programs.",,,Coverage,,,,,,No access to data,Public,,,"HIPPA, None",No,,,Low,Full current documentation,,,,,,,,,Low,No,,Barbara Patterson,,,,
Minority Health Data Pages,Minority Health Data Pages,Department of Health (AHS) / ,,http://healthvermont.gov/local/mhealth/documents/minority_hlth_data_pages_2013.pdf,,,,"The Office of Minority Health, located within the Vermont Department of Health, received a grant in 2010 to help<br />address persistent gaps in health status and access to health services among racial and ethnic populations in<br />Vermont.<br />One of the specific goals in the Minority Health Grant is to improve data quality, collection, and reporting among<br />Vermont data sources. This report is a first step towards accomplishing this goal as it provides a look at currently<br />available minority health data in Vermont. ",,,Population,,2013,,,,No,,,,None,No,,,Low,,,,,,,,,,Low,No,,Barbara Patterson,,,,
Vermont Environment Public Health Tracking Program (EPHT),Vermont Environment Public Health Tracking Program (EPHT),Department of Health (AHS) / ,,http://healthvermont.gov/tracking/index.aspx,David Grass,,,"The Tracking portal includes the most recent publicly available data for each indicator; years of data included vary by indicator but are generally available for the period 2000-2010 with 2011 and 2012 data available for several datasets. <br />Twenty three states plus New York City provide standardized data to the National Tracking network allowing comparison to Vermont data.   Vermont-specific measures include Standardized Incidence Ratios for specific cancers, the Blue Green Algae Tracker and the Tick Tracker.",,,Population,,2012,,,,Aggregate data only,"Administrators
Public",Web Application - Restricted Access,,None,No,,,Low,,,,,,,,,,Low,No,,Barbara Patterson,,,,
VMAP Access Database and CAREWare,VMAP Access Database and CAREWare,Department of Health (AHS) / ,,,,,,"The epidemiologist in the HIV/AIDS/STD/Hepatitis unit of the Infectious Disease Section<br />Database is updated as new information is reported to the health department; quarterly; and semi-annually depending on the source of the information. Data is uploaded to HRSA both quarterly and annually.<br />Integrated Epidemiologic Profiles for HIV/AIDS Prevention and Care Planning, Ryan White Services Report (RSR), ADAP (i.e. VMAP) Quarterly Report (AQR), Integrated Plan for HIV Services and Prevention.",,,Population,,2000-2013,,,,Unknown/Uncertain,,,,None,No,,,Low,,,,,,,,,,Low,No,,Barbara Patterson,,,,
Vermont Lead Database ,Vermont Lead Database ,Department of Health (AHS) / Division of Environmental Health,,,Michael Sullivan,,,"Any labs completing a blood lead test is required to report to the system (a 1032 database).  Blood leads are sent in many formats by all laboratories and providers that performed a test.  All capillary tests that are above the acceptable level, are required by statute to be followed up with a venous blood level test.<br />",,,Population,Provider,1993 - Present. Data is added to the database as information is reported by providers and laboratories in Vermont.,,,,No access to data,Legislators,,,None,No,,,Low,,,,,,,,,,Low,No,,Barbara Patterson,,,,
STDMIS - STD surveillance dataset,STDMIS - STD surveillance dataset,Department of Health (AHS) / Division of Health Surveillance,,,Daniel Daltry,,,"Any Vermont resident who is diagnosed with a reportable sexually transmitted infection (STI), regardless of state they are tested in.<br />This application stores data about patient residence, infection history, symptoms and treatment. It also identified indivduals sexual contacts and tracks testing information on them. Multiple STDS can be tracked in ",,,Clinical,,1996-2014,,,,No access to data,Practitioners (Health Care and Others),,,HIPPA,No,,,Low,,,,,,,,,,Low,No,,Barbara Patterson,,,,
SATIS - Substance Abuse Treatment Information System,SATIS - Substance Abuse Treatment Information System,Department of Health (AHS) / Division of Alcohol and Drug Abuse Programs (ADAP),,http://healthvermont.gov/adap/grantees/documents/SATIS_ProviderDataElements.pdf,Anne Van Donsel,,,Includes demographic information; collects information that allows an evaluation of change between admission and discharge.<br />The unique ID does not identify an individual – person level data can’t be directly linked to other sources of data.  ,,,"Population
Clinical",,2000-2013,,,,,,Web Application - Restricted Access,,None,No,,,Low,,,,,,,,,,Low,No,,Barbara Patterson,,,,
Refugee Health data system,Refugee Health data system,Department of Health (AHS) / ,,,Susan Schoenfeld,,,October 2012 through the present. Data system is updated as Domestic Health Assessment forms are received from health care providers doing these initial medical exams.  Data are reported to the Office of Refugee Resettlement (ORR) every 4 months.,,,Clinical,,October 2012 through the present.,,,,Unknown/Uncertain,,,,None,No,,,Low,,,,,,,,,,Low,No,,Barbara Patterson,,,,
Infectious Disease Outbreak Database,Infectious Disease Outbreak Database,Department of Health (AHS) / Division of Health Surveillance,,http://wwwn.cdc.gov/nndss/script/nedss.aspx,Laura Ann Nicolai,,,"Designed to capture descriptive information of infectious disease outbreaks that have occurred in Vermont or that involve Vermonters.<br />• Number exposed, ill, sent to doctor/ER, hospitalized, dead<br />• Location of outbreak, setting of outbreak <br />• Causative agent <br />• Mode of transmission <br />• Date outbreak started<br />• Lead investigator",,,Clinical,,Database is updated on a monthly basis. Data exists from 1999-2013,,,,Aggregate data only,,,,HIPPA,No,,,Low,Full current documentation,,,,,,,,,Low,No,,Barbara Patterson,,,,
Electronic HIV/AIDS Reporting System (eHARS),Electronic HIV/AIDS Reporting System (eHARS),Department of Health (AHS) / Division of Health Surveillance,,http://healthvermont.gov/prevent/aids/hiv_surveillance.aspx#data,Alex Goode,,,"Complete data available 1983 through 2013.  The system is updated as data is received. The system is updated as labs and case report forms are received at the health department, several times a week. Data is uploaded to CDC at the end of every month.<br />",,,Population,,1983-2013,,,,,,,,None,No,,,Low,,,,,,,,,,Low,No,,Barbara Patterson,,,,
EARS (Early Aberration Reporting System),EARS (Early Aberration Reporting System),Department of Health (AHS) / Division of Health Surveillance,,http://healthvermont.gov/enviro/tire_burn/med_plan.aspx,Bradley Tompkins,,,"Designed to capture and analyze recent Emergency department visit data for trends and signals of abnormal activity that may indicate the occurrence of events significant to public health (eg. outbreaks, unusual illnesses)<br />All Individual ED visits from participating Vermont hospitals (FAHC, CVH, Copley, BMH, NCH, SVMC)",,,"Services Provided
Clinical",,,,,,,,,Data is maintained and tracked by an epidemiologist in the Infectious Disease Section.  (As of Jan 2014-Bradley Tompkins)  ,None,No,,,Low,,,,,,,,,,Low,No,,Barbara Patterson,,,,
Washington County Mental Health Crisis Services Scorecard ,Washington County Mental Health Crisis Services Scorecard ,Washington County Mental Health Services (WCMHS) / ,,https://www.wcmhs.org/crisis-data.html,,,,Washington County Mental Health Services is committed to the Results Based Accountability (RBA) evaluation framework. Below is our Crisis Services Scorecard which answers the questions:<br />Results Scorecard software: http://resultsscorecard.com/<br /><br />“How much do we do?” “How well do we do it?” and “Is anyone better off?” on programmatic and population levels.<br /><br />This Scorecard is a very important lens in aiding in our consistent review of the effectiveness and quality of our programming. <br />,,,"Survey
Services Provided
Population",,,,,,No,"Policymakers
Public",Web Application - Restricted Access,,None,No,,,Low,,,,,,,,,,Low,No,,Barbara Patterson,,,,
